{
 "version": 1,
 "unit": "mm",
 "name": "Мыло туалетное — Дроггери (реальные ВГХ Mila, продажи синтетические)",
 "category": "Мытье тела",
 "store_format": "Дроггери",
 "created_at": "2026-09-25T13:30:00+03:00",
 "promo_mode": false,
 "shelf_units": [
  {
   "id": "shelf-soap-1",
   "label": "Пристенный 970×400×1650, 5 полок",
   "width_mm": 970,
   "depth_mm": 400,
   "height_mm": 1650,
   "shelf_count": 5,
   "mount": "shelf"
  }
 ],
 "sku_facings": [
  {
   "sku": "2020148",
   "name": "Мыло\"МЫЛОВАРЕННЫЕ ТРАДИЦИИ\"(лимон.)180г",
   "image_url": "",
   "shelf_unit_id": "shelf-soap-1",
   "shelf_no": 1,
   "x_mm": 0,
   "width_mm": 34,
   "height_mm": 50,
   "facings": 2
  },
  {
   "sku": "1991628",
   "name": "Мыло туалетное твердое Завод братьевъ Крестовниковыхъ Медово",
   "image_url": "",
   "shelf_unit_id": "shelf-soap-1",
   "shelf_no": 1,
   "x_mm": 68,
   "width_mm": 92,
   "height_mm": 30,
   "facings": 2
  },
  {
   "sku": "2074871",
   "name": "Мыло для рук и тела SYNERGETIC натуральное биоразлагаемое са",
   "image_url": "",
   "shelf_unit_id": "shelf-soap-1",
   "shelf_no": 1,
   "x_mm": 252,
   "width_mm": 65,
   "height_mm": 190,
   "facings": 2
  },
  {
   "sku": "2020129",
   "name": "Мыло \"BOVARY\" (Mon ami, роза) 60г",
   "image_url": "",
   "shelf_unit_id": "shelf-soap-1",
   "shelf_no": 1,
   "x_mm": 382,
   "width_mm": 34,
   "height_mm": 50,
   "facings": 2
  },
  {
   "sku": "2001175",
   "name": "Мыло туалетное твердое Flirt \"Апельсин\" 75г",
   "image_url": "",
   "shelf_unit_id": "shelf-soap-1",
   "shelf_no": 1,
   "x_mm": 450,
   "width_mm": 72,
   "height_mm": 25,
   "facings": 2
  },
  {
   "sku": "2113381",
   "name": "Крем-мыло DOVE delicious care нежный уход 135 г",
   "image_url": "",
   "shelf_unit_id": "shelf-soap-1",
   "shelf_no": 1,
   "x_mm": 594,
   "width_mm": 67,
   "height_mm": 35,
   "facings": 2
  },
  {
   "sku": "2055705",
   "name": "Мыло твердое туалетное JEANNE EN PROVENCE Секрет жасмина, 10",
   "image_url": "",
   "shelf_unit_id": "shelf-soap-1",
   "shelf_no": 1,
   "x_mm": 728,
   "width_mm": 33,
   "height_mm": 48,
   "facings": 2
  },
  {
   "sku": "1055155",
   "name": "Мыло ГЖК Просто мыло Земляничное 4*75г",
   "image_url": "",
   "shelf_unit_id": "shelf-soap-1",
   "shelf_no": 1,
   "x_mm": 794,
   "width_mm": 42,
   "height_mm": 110,
   "facings": 2
  },
  {
   "sku": "2020169",
   "name": "Мыло туалетное \"GRAND ШАРМ\"(перс-л.экоп.)4x90",
   "image_url": "",
   "shelf_unit_id": "shelf-soap-1",
   "shelf_no": 2,
   "x_mm": 0,
   "width_mm": 60,
   "height_mm": 75,
   "facings": 2
  },
  {
   "sku": "2020120",
   "name": "Мыло р/работы\"МАЛИНОВОЕ НАСТРОЕНИЕ\" 100г",
   "image_url": "",
   "shelf_unit_id": "shelf-soap-1",
   "shelf_no": 2,
   "x_mm": 120,
   "width_mm": 30,
   "height_mm": 65,
   "facings": 2
  },
  {
   "sku": "2126164",
   "name": "Мыло жидкое Flirt \"Ананас\", 1 л",
   "image_url": "",
   "shelf_unit_id": "shelf-soap-1",
   "shelf_no": 2,
   "x_mm": 180,
   "width_mm": 77,
   "height_mm": 265,
   "facings": 2
  },
  {
   "sku": "1003115",
   "name": "Крем-мыло туалетное Duru 1+1 4x90г Увлажняющий крем и морски",
   "image_url": "",
   "shelf_unit_id": "shelf-soap-1",
   "shelf_no": 2,
   "x_mm": 334,
   "width_mm": 45,
   "height_mm": 105,
   "facings": 1
  },
  {
   "sku": "1034939",
   "name": "Крем-мыло жидкое Luksja Creamy 900мл (наполнитель) с молочко",
   "image_url": "",
   "shelf_unit_id": "shelf-soap-1",
   "shelf_no": 2,
   "x_mm": 379,
   "width_mm": 80,
   "height_mm": 210,
   "facings": 1
  },
  {
   "sku": "1040594",
   "name": "Крем-мыло нежное Liv Delano Organnic oils collec 500г с перс",
   "image_url": "",
   "shelf_unit_id": "shelf-soap-1",
   "shelf_no": 2,
   "x_mm": 459,
   "width_mm": 83,
   "height_mm": 145,
   "facings": 1
  },
  {
   "sku": "1997276",
   "name": "Мыло туалетное SAFEGUARD Деликатное 5х70г",
   "image_url": "",
   "shelf_unit_id": "shelf-soap-1",
   "shelf_no": 2,
   "x_mm": 542,
   "width_mm": 45,
   "height_mm": 80,
   "facings": 1
  },
  {
   "sku": "1206079",
   "name": "Крем-мыло туалетное твердое Лесная полянка Клубника со сливк",
   "image_url": "",
   "shelf_unit_id": "shelf-soap-1",
   "shelf_no": 2,
   "x_mm": 587,
   "width_mm": 44,
   "height_mm": 79,
   "facings": 1
  },
  {
   "sku": "1029160",
   "name": "Мыло Palmolive Натурэль Питание 5*70г с экстрактом меда и мо",
   "image_url": "",
   "shelf_unit_id": "shelf-soap-1",
   "shelf_no": 2,
   "x_mm": 631,
   "width_mm": 47,
   "height_mm": 75,
   "facings": 1
  },
  {
   "sku": "2057032",
   "name": "Мыло NESTI DANTE Amore Relax / Релакс, 170г",
   "image_url": "",
   "shelf_unit_id": "shelf-soap-1",
   "shelf_no": 2,
   "x_mm": 678,
   "width_mm": 30,
   "height_mm": 55,
   "facings": 1
  },
  {
   "sku": "1038209",
   "name": "Мыло туалетное SAFEGUARD Классический 5х75г",
   "image_url": "",
   "shelf_unit_id": "shelf-soap-1",
   "shelf_no": 2,
   "x_mm": 708,
   "width_mm": 45,
   "height_mm": 80,
   "facings": 1
  },
  {
   "sku": "1003812",
   "name": "Мыло жидкое Травы и сборы Агафьи Для Бани цветочное",
   "image_url": "",
   "shelf_unit_id": "shelf-soap-1",
   "shelf_no": 2,
   "x_mm": 753,
   "width_mm": 104,
   "height_mm": 77,
   "facings": 1
  },
  {
   "sku": "2081344",
   "name": "Крем-мыло туалетное Duru Арбуз с экстрактом алоэ 80г",
   "image_url": "",
   "shelf_unit_id": "shelf-soap-1",
   "shelf_no": 2,
   "x_mm": 857,
   "width_mm": 80,
   "height_mm": 50,
   "facings": 1
  },
  {
   "sku": "1162824",
   "name": "Мыло Целебные травы Облепиха 160г арт.926-2",
   "image_url": "",
   "shelf_unit_id": "shelf-soap-1",
   "shelf_no": 2,
   "x_mm": 937,
   "width_mm": 25,
   "height_mm": 60,
   "facings": 1
  },
  {
   "sku": "1038295",
   "name": "Крем-мыло Dove Гипоаллергенное 135г д/чувствительной кожи",
   "image_url": "",
   "shelf_unit_id": "shelf-soap-1",
   "shelf_no": 3,
   "x_mm": 0,
   "width_mm": 100,
   "height_mm": 70,
   "facings": 1
  },
  {
   "sku": "1001082",
   "name": "Крем-мыло Dove Прикосновение свежести",
   "image_url": "",
   "shelf_unit_id": "shelf-soap-1",
   "shelf_no": 3,
   "x_mm": 100,
   "width_mm": 30,
   "height_mm": 60,
   "facings": 1
  },
  {
   "sku": "2073836",
   "name": "Мыло туалетное BioMio экологичное Bio-Soap.Литсея и бергамот",
   "image_url": "",
   "shelf_unit_id": "shelf-soap-1",
   "shelf_no": 3,
   "x_mm": 130,
   "width_mm": 30,
   "height_mm": 60,
   "facings": 1
  }
 ]
}